{"schema_version":"1.0.0","proposal_id":"CP-0001","minimum_average":4.0,"critical_dimensions":["result_quality","canon_fidelity","state_continuity","process_compliance"],"cases":[{"case_id":"review-ep001","current_output":"tests/fixtures/sample_manuscript.txt","candidate_output":"tests/fixtures/style_audit_sample.txt","human_final":"tests/fixtures/manuscript_clean_sample.txt","scores":{"result_quality":{"current":3.5,"candidate":4.2,"evidence":"candidate restores the human-approved scene purpose"},"canon_fidelity":{"current":4.0,"candidate":5.0,"evidence":"candidate uses only canonical facts"},"state_continuity":{"current":3.0,"candidate":5.0,"evidence":"candidate preserves knowledge boundaries"},"process_compliance":{"current":3.0,"candidate":5.0,"evidence":"candidate uses the required Evidence Pack"},"style_fit":{"current":4.0,"candidate":4.2,"evidence":"approved rhythm retained"},"efficiency":{"current":4.0,"candidate":4.0,"evidence":"no additional unused retrieval"}},"critical_failures":{"current":["CHARACTER_STATE_DRIFT"],"candidate":[]}}]}
